{
 "$schema": "https://json-schema.org/draft/2020-12/schema",
 "$id": "https://github.com/tensortransit/schemas/receipt.schema.json",
 "title": "TensorTransit Frontier Receipt",
 "description": "The permanent, machine-readable evidence artifact for one authoritative evaluation. It has to answer, years later and without the box that produced it: which generation, which baseline, which candidate, on what hardware, under what runtime, against what model, with what correctness result, at what confidence, and how much frontier was created.",
 "type": "object",
 "required": [
  "receipt_schema_version",
  "benchmark_generation",
  "generation_checksum",
  "correctness",
  "frontier",
  "coverage",
  "statistics",
  "status",
  "content_digest"
 ],
 "additionalProperties": true,
 "properties": {
  "receipt_schema_version": {
   "const": 1
  },
  "benchmark_generation": {
   "type": "string",
   "pattern": "^TTF-"
  },
  "generation_checksum": {
   "type": "string",
   "pattern": "^sha256:[0-9a-f]{64}$",
   "description": "The generation this was scored under, hashed. A generation is frozen; if its meaning changed, the answer is a new TTF-N and not an edit, and this is what makes that enforceable rather than promised."
  },
  "timestamp_utc": {
   "type": "string"
  },
  "pr": {
   "type": [
    "integer",
    "null"
   ]
  },
  "baseline_commit": {
   "type": [
    "string",
    "null"
   ]
  },
  "candidate_commit": {
   "type": [
    "string",
    "null"
   ]
  },
  "evaluator_commit": {
   "type": [
    "string",
    "null"
   ]
  },
  "hardware": {
   "type": "object",
   "additionalProperties": true
  },
  "runtime": {
   "type": "object",
   "additionalProperties": true
  },
  "model": {
   "type": "object",
   "additionalProperties": true
  },
  "environment_fingerprint": {
   "type": [
    "string",
    "null"
   ]
  },
  "mode": {
   "type": "string",
   "description": "`authoritative` is the trusted evaluator's run; `public` is a contributor iterating locally."
  },
  "instances": {
   "type": "string",
   "description": "Whether the generation's workload instances are public or hidden. TTF-1's are public, and its generation.json says why rather than pretending otherwise."
  },
  "correctness": {
   "enum": [
    "PASS",
    "FAIL",
    "BUILD_FAIL",
    "UNSCORABLE",
    "SKIPPED"
   ]
  },
  "correctness_method": {
   "type": "string"
  },
  "correctness_compared_against": {
   "type": "string",
   "description": "Which build produced the control replays. `baseline build` means the gate asked whether the SUBMISSION changes the model's output; `candidate build` means it only asked whether enabling the policy does, which a submission whose inert path changed the output would pass."
  },
  "frontier": {
   "type": "object",
   "required": [
    "before",
    "after",
    "gain_percent",
    "verified_gain_percent"
   ],
   "properties": {
    "before": {
     "type": "number",
     "minimum": 0
    },
    "after": {
     "type": "number",
     "minimum": 0
    },
    "gain_percent": {
     "type": "number",
     "description": "What was MEASURED. Recorded whatever the status, so a CORRECTNESS_FAIL is debuggable."
    },
    "verified_gain_percent": {
     "type": "number",
     "description": "What the ledger CREDITS. Zero unless the status is FRONTIER_GAIN."
    },
    "credit_withheld": {
     "type": [
      "object",
      "null"
     ],
     "additionalProperties": true,
     "description": "Present and non-null when a measured gain was NOT credited to the ledger, with the reason. Today the only reason is partial coverage: a receipt that did not score every cell the generation declares credits nothing."
    }
   }
  },
  "objectives": {
   "type": "array",
   "items": {
    "type": "object"
   }
  },
  "cell_objectives": {
   "type": "object",
   "description": "The frozen bounds each cell was actually scored under. Without them a reader cannot reproduce a hypervolume from the raw results, and a receipt that cannot be reproduced is a claim rather than evidence."
  },
  "reference_point": {
   "type": "array",
   "items": {
    "type": "number"
   }
  },
  "aggregation": {
   "type": "object",
   "properties": {
    "method": {
     "type": "string"
    },
    "weights": {
     "type": "object"
    },
    "cell_floor": {
     "type": "number",
     "exclusiveMinimum": 0
    },
    "cells_at_floor": {
     "type": "object",
     "description": "Cells whose hypervolume was zero for an arm and were scored at the floor instead. One such cell can move dF by a large multiple through the geometric mean, so it is named rather than absorbed."
    },
    "floor_decided": {
     "type": "boolean"
    },
    "floor_decided_inside_published_noise": {
     "type": "array",
     "items": {
      "type": "object",
      "additionalProperties": true
     },
     "description": "Floor decisions taken on an objective whose PUBLISHED per-cell control spread -- frozen with the generation at calibration -- is larger than the change observed. A score that rests on one of these is not evidence about the candidate, whatever its confidence interval says."
    }
   }
  },
  "coverage": {
   "type": "object",
   "required": [
    "improved_cells",
    "neutral_cells",
    "regressed_cells",
    "total_cells"
   ],
   "properties": {
    "improved_cells": {
     "type": "integer",
     "minimum": 0
    },
    "neutral_cells": {
     "type": "integer",
     "minimum": 0
    },
    "regressed_cells": {
     "type": "integer",
     "minimum": 0
    },
    "total_cells": {
     "type": "integer",
     "minimum": 1
    },
    "scored_cells": {
     "type": "integer",
     "minimum": 0
    },
    "missing_cells": {
     "type": "array",
     "items": {
      "type": "string"
     }
    },
    "partial": {
     "type": "boolean",
     "description": "True when the generation declares a cell this run did not measure. A hole is named, never renormalised away."
    },
    "unservable_cells": {
     "type": "array",
     "items": {
      "type": "string"
     },
     "description": "Cells excluded from the score because the candidate produced no operating point there and an evaluator probe running NO policy reproduced the same serving failure on the baseline binary. The control is unhooked and emits no packing telemetry, so a cell that collapses in BOTH arms can only be seen to collapse in the hooked one; charged to the candidate it would be scored at the generation's floor, which moves the gain through the geometric mean by more than any policy in this repository has. A receipt carrying any of these is PARTIAL on its face."
    },
    "unservable_evidence": {
     "type": "object",
     "additionalProperties": true,
     "description": "Per unservable cell: the probe's status, the configuration it ran and the binary it ran, so a drop can be argued with rather than trusted."
    }
   }
  },
  "cells": {
   "type": "object",
   "additionalProperties": {
    "type": "object",
    "properties": {
     "gain": {
      "type": "number"
     },
     "hypervolume": {
      "type": "object"
     },
     "weight": {
      "type": "number"
     },
     "protected": {
      "type": "boolean"
     },
     "on_frontier": {
      "type": "object",
      "description": "Which configurations were non-dominated in this cell, by variant. This is where a new planner earns its place: it does not have to beat every existing strategy everywhere, it has to hold territory somewhere."
     }
    }
   }
  },
  "configurations": {
   "type": "object"
  },
  "failures": {
   "type": "object",
   "description": "Measurements that produced no operating point, by variant and reason. A run that lost a region says so."
  },
  "statistics": {
   "type": "object",
   "required": [
    "confidence_level",
    "lower_gain_percent",
    "upper_gain_percent",
    "paired_repeats",
    "method",
    "resamples",
    "seed"
   ],
   "properties": {
    "confidence_level": {
     "type": "number",
     "exclusiveMinimum": 0.5,
     "exclusiveMaximum": 1
    },
    "lower_gain_percent": {
     "type": "number"
    },
    "upper_gain_percent": {
     "type": "number"
    },
    "paired_repeats": {
     "type": "integer",
     "minimum": 1
    },
    "unpaired_repeats": {
     "type": "array"
    },
    "method": {
     "type": "string"
    },
    "resamples": {
     "type": "integer",
     "minimum": 0
    },
    "seed": {
     "type": "integer",
     "description": "Frozen, so the receipt is reproducible bit for bit from its raw results."
    },
    "per_repeat_frontier": {
     "type": "object"
    }
   }
  },
  "regression_guard": {
   "type": "object"
  },
  "supersedes": {
   "type": "array",
   "items": {
    "type": "string"
   }
  },
  "supersede_reason": {
   "type": "string"
  },
  "status": {
   "enum": [
    "FRONTIER_GAIN",
    "NO_FRONTIER_GAIN",
    "INCONCLUSIVE",
    "CORRECTNESS_FAIL",
    "BUILD_FAIL",
    "REGRESSION_GUARD_FAIL",
    "EVAL_ERROR"
   ],
   "description": "Evaluation STATE. None of these categorizes impact magnitude: there are no XS/S/M/L/XL bands anywhere in this system, and frontier/README.md says why."
  },
  "content_digest": {
   "type": "string",
   "pattern": "^sha256:[0-9a-f]{64}$",
   "description": "SHA-256 over every scored field. `tt-frontier receipt verify` recomputes it, which is what turns 'a finalized receipt is never silently rewritten' from a rule into a check."
  },
  "cell_resolution": {
   "type": "object",
   "additionalProperties": true,
   "description": "Per cell, per objective: the published control spread, the observed change, and whether the second exceeds the first. Diagnostic; it never moves a score. It says which cells the score is entitled to rest on."
  },
  "resolution_summary": {
   "type": "object",
   "additionalProperties": true,
   "description": "Per objective: which scored cells moved by more than the spread the generation published for them, and what share of the scored weight that is. A receipt whose objectives resolve on a tenth of the matrix is not a weaker result than one that resolves everywhere -- it is a different kind of statement."
  }
 }
}
