{
 "aggregation": {
  "cell_floor": 1e-06,
  "cells_at_floor": {
   "candidate": [],
   "main": []
  },
  "floor_decided": false,
  "floor_decided_inside_published_noise": [],
  "method": "geometric_mean",
  "weights": {
   "ctx128-c1": 1.0,
   "ctx128-c16": 1.0,
   "ctx128-c32": 1.0,
   "ctx128-c4": 1.0,
   "ctx16384-c1": 1.0,
   "ctx4096-c1": 1.0,
   "ctx4096-c16": 1.0,
   "ctx4096-c32": 1.0
  }
 },
 "baseline_commit": "f89b1291142cab50757516d6115109724d6aa136",
 "benchmark_generation": "TTF-1",
 "candidate_commit": "f89b1291142cab50757516d6115109724d6aa136",
 "cell_objectives": {
  "ctx128-c1": [
   {
    "direction": "max",
    "hi": 278.4,
    "key": "goodput_tps",
    "lo": 0.0,
    "unit": "tok/s"
   },
   {
    "direction": "min",
    "hi": 0.0,
    "key": "p99_itl_ms",
    "lo": 48.546,
    "unit": "ms"
   }
  ],
  "ctx128-c16": [
   {
    "direction": "max",
    "hi": 2265.2,
    "key": "goodput_tps",
    "lo": 0.0,
    "unit": "tok/s"
   },
   {
    "direction": "min",
    "hi": 0.0,
    "key": "p99_itl_ms",
    "lo": 135.729,
    "unit": "ms"
   }
  ],
  "ctx128-c32": [
   {
    "direction": "max",
    "hi": 3636.8,
    "key": "goodput_tps",
    "lo": 0.0,
    "unit": "tok/s"
   },
   {
    "direction": "min",
    "hi": 0.0,
    "key": "p99_itl_ms",
    "lo": 136.494,
    "unit": "ms"
   }
  ],
  "ctx128-c4": [
   {
    "direction": "max",
    "hi": 888.4,
    "key": "goodput_tps",
    "lo": 0.0,
    "unit": "tok/s"
   },
   {
    "direction": "min",
    "hi": 0.0,
    "key": "p99_itl_ms",
    "lo": 112.92,
    "unit": "ms"
   }
  ],
  "ctx16384-c1": [
   {
    "direction": "max",
    "hi": 90.4,
    "key": "goodput_tps",
    "lo": 0.0,
    "unit": "tok/s"
   },
   {
    "direction": "min",
    "hi": 0.0,
    "key": "p99_itl_ms",
    "lo": 50.988,
    "unit": "ms"
   }
  ],
  "ctx4096-c1": [
   {
    "direction": "max",
    "hi": 224.0,
    "key": "goodput_tps",
    "lo": 0.0,
    "unit": "tok/s"
   },
   {
    "direction": "min",
    "hi": 0.0,
    "key": "p99_itl_ms",
    "lo": 48.882,
    "unit": "ms"
   }
  ],
  "ctx4096-c16": [
   {
    "direction": "max",
    "hi": 588.0,
    "key": "goodput_tps",
    "lo": 0.0,
    "unit": "tok/s"
   },
   {
    "direction": "min",
    "hi": 0.0,
    "key": "p99_itl_ms",
    "lo": 141.822,
    "unit": "ms"
   }
  ],
  "ctx4096-c32": [
   {
    "direction": "max",
    "hi": 726.0,
    "key": "goodput_tps",
    "lo": 0.0,
    "unit": "tok/s"
   },
   {
    "direction": "min",
    "hi": 0.0,
    "key": "p99_itl_ms",
    "lo": 167.94,
    "unit": "ms"
   }
  ]
 },
 "cell_resolution": {
  "ctx128-c1": {
   "goodput_tps": {
    "candidate_median": 68.8,
    "configuration": "persist",
    "main_median": 69.0,
    "observed_change_pct": 0.28985507246377223,
    "per_configuration_change_pct": {
     "persist": 0.28985507246377223
    },
    "published_control_spread_pct": 0.1437,
    "resolves": true
   },
   "p99_itl_ms": {
    "candidate_median": 17.155,
    "configuration": "persist",
    "main_median": 16.719,
    "observed_change_pct": 2.6078114719779886,
    "per_configuration_change_pct": {
     "persist": 2.6078114719779886
    },
    "published_control_spread_pct": 0.9393,
    "resolves": true
   }
  },
  "ctx128-c16": {
   "goodput_tps": {
    "candidate_median": 559.6,
    "configuration": "persist",
    "main_median": 561.9,
    "observed_change_pct": 0.40932550275848983,
    "per_configuration_change_pct": {
     "persist": 0.40932550275848983
    },
    "published_control_spread_pct": 0.4238,
    "resolves": false
   },
   "p99_itl_ms": {
    "candidate_median": 44.824,
    "configuration": "persist",
    "main_median": 43.824,
    "observed_change_pct": 2.281854691493246,
    "per_configuration_change_pct": {
     "persist": 2.281854691493246
    },
    "published_control_spread_pct": 6.6927,
    "resolves": false
   }
  },
  "ctx128-c32": {
   "goodput_tps": {
    "candidate_median": 887.7,
    "configuration": "persist",
    "main_median": 897.6,
    "observed_change_pct": 1.1029411764705856,
    "per_configuration_change_pct": {
     "persist": 1.1029411764705856
    },
    "published_control_spread_pct": 1.7378,
    "resolves": false
   },
   "p99_itl_ms": {
    "candidate_median": 48.709,
    "configuration": "persist",
    "main_median": 46.309,
    "observed_change_pct": 5.182577900624081,
    "per_configuration_change_pct": {
     "persist": 5.182577900624081
    },
    "published_control_spread_pct": 481.0431,
    "resolves": false
   }
  },
  "ctx128-c4": {
   "goodput_tps": {
    "candidate_median": 219.6,
    "configuration": "persist",
    "main_median": 220.2,
    "observed_change_pct": 0.27247956403269497,
    "per_configuration_change_pct": {
     "persist": 0.27247956403269497
    },
    "published_control_spread_pct": 0.09,
    "resolves": true
   },
   "p99_itl_ms": {
    "candidate_median": 39.357,
    "configuration": "persist",
    "main_median": 38.779,
    "observed_change_pct": 1.4904974341782815,
    "per_configuration_change_pct": {
     "persist": 1.4904974341782815
    },
    "published_control_spread_pct": 0.7784,
    "resolves": true
   }
  },
  "ctx16384-c1": {
   "goodput_tps": {
    "candidate_median": 22.4,
    "configuration": "persist",
    "main_median": 22.5,
    "observed_change_pct": 0.44444444444445075,
    "per_configuration_change_pct": {
     "persist": 0.44444444444445075
    },
    "published_control_spread_pct": 0.0,
    "resolves": true
   },
   "p99_itl_ms": {
    "candidate_median": 17.645,
    "configuration": "persist",
    "main_median": 17.307,
    "observed_change_pct": 1.9529670075691972,
    "per_configuration_change_pct": {
     "persist": 1.9529670075691972
    },
    "published_control_spread_pct": 1.871,
    "resolves": true
   }
  },
  "ctx4096-c1": {
   "goodput_tps": {
    "candidate_median": 55.5,
    "configuration": "persist",
    "main_median": 55.6,
    "observed_change_pct": 0.17985611510791621,
    "per_configuration_change_pct": {
     "persist": 0.17985611510791621
    },
    "published_control_spread_pct": 0.1786,
    "resolves": true
   },
   "p99_itl_ms": {
    "candidate_median": 17.273,
    "configuration": "persist",
    "main_median": 16.725,
    "observed_change_pct": 3.2765321375186742,
    "per_configuration_change_pct": {
     "persist": 3.2765321375186742
    },
    "published_control_spread_pct": 1.2888,
    "resolves": true
   }
  },
  "ctx4096-c16": {
   "goodput_tps": {
    "candidate_median": 144.8,
    "configuration": "persist",
    "main_median": 145.9,
    "observed_change_pct": 0.7539410555174738,
    "per_configuration_change_pct": {
     "persist": 0.7539410555174738
    },
    "published_control_spread_pct": 0.2041,
    "resolves": true
   },
   "p99_itl_ms": {
    "candidate_median": 51.071,
    "configuration": "persist",
    "main_median": 48.092,
    "observed_change_pct": 6.194377443233801,
    "per_configuration_change_pct": {
     "persist": 6.194377443233801
    },
    "published_control_spread_pct": 4.8462,
    "resolves": true
   }
  },
  "ctx4096-c32": {
   "goodput_tps": {
    "candidate_median": 168.0,
    "configuration": "persist",
    "main_median": 180.0,
    "observed_change_pct": 6.666666666666667,
    "per_configuration_change_pct": {
     "persist": 6.666666666666667
    },
    "published_control_spread_pct": 39.0083,
    "resolves": false
   },
   "p99_itl_ms": {
    "candidate_median": 52.778,
    "configuration": "persist",
    "main_median": 55.686,
    "observed_change_pct": 5.222138418992209,
    "per_configuration_change_pct": {
     "persist": 5.222138418992209
    },
    "published_control_spread_pct": 41.6631,
    "resolves": false
   }
  }
 },
 "cells": {
  "ctx128-c1": {
   "gain": -0.01512848219745977,
   "hypervolume": {
    "candidate": 0.16003010505263168,
    "main": 0.16248830650488624
   },
   "on_frontier": {
    "candidate": [
     "persist"
    ],
    "main": [
     "control"
    ]
   },
   "protected": true,
   "weight": 1.0
  },
  "ctx128-c16": {
   "gain": -0.013345237343834082,
   "hypervolume": {
    "candidate": 0.165723533934146,
    "main": 0.1679650676271028
   },
   "on_frontier": {
    "candidate": [
     "persist"
    ],
    "main": [
     "control"
    ]
   },
   "protected": true,
   "weight": 1.0
  },
  "ctx128-c32": {
   "gain": -0.04384213644027646,
   "hypervolume": {
    "candidate": 0.15592428998634011,
    "main": 0.16307379349037876
   },
   "on_frontier": {
    "candidate": [
     "persist"
    ],
    "main": [
     "control"
    ]
   },
   "protected": false,
   "weight": 1.0
  },
  "ctx128-c4": {
   "gain": -0.009147732979655876,
   "hypervolume": {
    "candidate": 0.16125204908129867,
    "main": 0.16274075808113164
   },
   "on_frontier": {
    "candidate": [
     "persist"
    ],
    "main": [
     "control"
    ]
   },
   "protected": false,
   "weight": 1.0
  },
  "ctx16384-c1": {
   "gain": -0.014435174463676703,
   "hypervolume": {
    "candidate": 0.1620377794948803,
    "main": 0.16441108214946978
   },
   "on_frontier": {
    "candidate": [
     "persist"
    ],
    "main": [
     "control"
    ]
   },
   "protected": false,
   "weight": 1.0
  },
  "ctx4096-c1": {
   "gain": -0.018931336694271605,
   "hypervolume": {
    "candidate": 0.16021632086306967,
    "main": 0.1633079588162748
   },
   "on_frontier": {
    "candidate": [
     "persist"
    ],
    "main": [
     "control"
    ]
   },
   "protected": false,
   "weight": 1.0
  },
  "ctx4096-c16": {
   "gain": -0.029098075224476494,
   "hypervolume": {
    "candidate": 0.15929133933050313,
    "main": 0.16406532448406871
   },
   "on_frontier": {
    "candidate": [
     "persist"
    ],
    "main": [
     "control"
    ]
   },
   "protected": false,
   "weight": 1.0
  },
  "ctx4096-c32": {
   "gain": -0.04355088795275541,
   "hypervolume": {
    "candidate": 0.15868201650136757,
    "main": 0.1659074325049186
   },
   "on_frontier": {
    "candidate": [
     "persist"
    ],
    "main": [
     "control"
    ]
   },